{"uri":"file:/FIXTURE/SAMPLE.cbl","language":"cobol","schemaVersion":1,"tree":{"id":"n0","kind":"RootNode","locality":{"uri":"file:/FIXTURE/SAMPLE.cbl","range":{"start":{"line":0,"character":7},"end":{"line":100,"character":53}}},"nodeType":"ROOT","children":[{"id":"n1","kind":"ProgramNode","programName":"SAMPLE","subtype":"Program","ordinal":1,"repository":{},"locality":{"uri":"file:/FIXTURE/SAMPLE.cbl","range":{"start":{"line":0,"character":7},"end":{"line":100,"character":53}}},"nodeType":"PROGRAM","children":[{"id":"n2","kind":"DivisionNode","divisionType":"IDENTIFICATION_DIVISION","locality":{"uri":"file:/FIXTURE/SAMPLE.cbl","range":{"start":{"line":0,"character":7},"end":{"line":1,"character":26}}},"nodeType":"DIVISION","children":[{"id":"n3","kind":"ProgramIdNode","programId":"SAMPLE","subtype":"Program","definitions":[],"usages":[],"locality":{"uri":"file:/FIXTURE/SAMPLE.cbl","range":{"start":{"line":1,"character":7},"end":{"line":1,"character":26}}},"nodeType":"PROGRAM_ID","children":[]}]},{"id":"n4","kind":"DivisionNode","divisionType":"ENVIRONMENT_DIVISION","locality":{"uri":"file:/FIXTURE/SAMPLE.cbl","range":{"start":{"line":2,"character":7},"end":{"line":10,"character":46}}},"nodeType":"DIVISION","children":[{"id":"n5","kind":"SectionNode","sectionType":"INPUT_OUTPUT","locality":{"uri":"file:/FIXTURE/SAMPLE.cbl","range":{"start":{"line":3,"character":7},"end":{"line":10,"character":46}}},"nodeType":"SECTION","children":[{"id":"n6","kind":"FileEntryNode","fileName":"ACCT-FILE","fileControlClause":"ASSIGN TO ACCTDD\n                  ORGANIZATION IS INDEXED\n                  ACCESS MODE IS RANDOM\n                  RECORD KEY IS ACCT-KEY\n                  FILE STATUS IS WS-FILE-STATUS","locality":{"uri":"file:/FIXTURE/SAMPLE.cbl","range":{"start":{"line":5,"character":11},"end":{"line":9,"character":48}}},"nodeType":"FILE_CONTROL_ENTRY","children":[{"id":"n7","kind":"QualifiedReferenceNode","variableDefinitionNode":{"ref":"n18"},"locality":{"uri":"file:/FIXTURE/SAMPLE.cbl","range":{"start":{"line":5,"character":18},"end":{"line":5,"character":27}}},"nodeType":"QUALIFIED_REFERENCE_NODE","children":[{"id":"n8","kind":"VariableUsageNode","name":"ACCT-FILE","definitions":[{"ref":"n18"}],"isDefinitionMandatory":true,"locality":{"uri":"file:/FIXTURE/SAMPLE.cbl","range":{"start":{"line":5,"character":18},"end":{"line":5,"character":27}}},"nodeType":"VARIABLE_USAGE","children":[]}]},{"id":"n9","kind":"QualifiedReferenceNode","variableDefinitionNode":{"ref":"n22"},"locality":{"uri":"file:/FIXTURE/SAMPLE.cbl","range":{"start":{"line":8,"character":32},"end":{"line":8,"character":40}}},"nodeType":"QUALIFIED_REFERENCE_NODE","children":[{"id":"n10","kind":"VariableUsageNode","name":"ACCT-KEY","definitions":[{"ref":"n22"}],"isDefinitionMandatory":true,"locality":{"uri":"file:/FIXTURE/SAMPLE.cbl","range":{"start":{"line":8,"character":32},"end":{"line":8,"character":40}}},"nodeType":"VARIABLE_USAGE","children":[]}]},{"id":"n11","kind":"QualifiedReferenceNode","variableDefinitionNode":{"ref":"n41"},"locality":{"uri":"file:/FIXTURE/SAMPLE.cbl","range":{"start":{"line":9,"character":33},"end":{"line":9,"character":47}}},"nodeType":"QUALIFIED_REFERENCE_NODE","children":[{"id":"n12","kind":"VariableUsageNode","name":"WS-FILE-STATUS","definitions":[{"ref":"n41"}],"isDefinitionMandatory":true,"locality":{"uri":"file:/FIXTURE/SAMPLE.cbl","range":{"start":{"line":9,"character":33},"end":{"line":9,"character":47}}},"nodeType":"VARIABLE_USAGE","children":[]}]}]},{"id":"n13","kind":"FileEntryNode","fileName":"REPORT-FILE","fileControlClause":"ASSIGN TO RPTDD","locality":{"uri":"file:/FIXTURE/SAMPLE.cbl","range":{"start":{"line":10,"character":11},"end":{"line":10,"character":46}}},"nodeType":"FILE_CONTROL_ENTRY","children":[{"id":"n14","kind":"QualifiedReferenceNode","variableDefinitionNode":{"ref":"n26"},"locality":{"uri":"file:/FIXTURE/SAMPLE.cbl","range":{"start":{"line":10,"character":18},"end":{"line":10,"character":29}}},"nodeType":"QUALIFIED_REFERENCE_NODE","children":[{"id":"n15","kind":"VariableUsageNode","name":"REPORT-FILE","definitions":[{"ref":"n26"}],"isDefinitionMandatory":true,"locality":{"uri":"file:/FIXTURE/SAMPLE.cbl","range":{"start":{"line":10,"character":18},"end":{"line":10,"character":29}}},"nodeType":"VARIABLE_USAGE","children":[]}]}]}]}]},{"id":"n16","kind":"DivisionNode","divisionType":"DATA_DIVISION","locality":{"uri":"file:/FIXTURE/SAMPLE.cbl","range":{"start":{"line":11,"character":7},"end":{"line":32,"character":44}}},"nodeType":"DIVISION","children":[{"id":"n17","kind":"SectionNode","sectionType":"FILE","locality":{"uri":"file:/FIXTURE/SAMPLE.cbl","range":{"start":{"line":12,"character":7},"end":{"line":18,"character":45}}},"nodeType":"SECTION","children":[{"id":"n18","kind":"FileDescriptionNode","isExternal":false,"fileDescriptorText":"FD  ACCT-FILE.","fileControlClause":"ASSIGN TO ACCTDD\nORGANIZATION IS INDEXED\nACCESS MODE IS RANDOM\nRECORD KEY IS ACCT-KEY\nFILE STATUS IS WS-FILE-STATUS","variableType":"FD","name":"ACCT-FILE","global":false,"synchronizedClause":false,"usages":[{"uri":"file:/FIXTURE/SAMPLE.cbl","range":{"start":{"line":5,"character":18},"end":{"line":5,"character":27}}},{"uri":"file:/FIXTURE/SAMPLE.cbl","range":{"start":{"line":46,"character":22},"end":{"line":46,"character":31}}},{"uri":"file:/FIXTURE/SAMPLE.cbl","range":{"start":{"line":48,"character":16},"end":{"line":48,"character":25}}},{"uri":"file:/FIXTURE/SAMPLE.cbl","range":{"start":{"line":53,"character":17},"end":{"line":53,"character":26}}}],"locality":{"uri":"file:/FIXTURE/SAMPLE.cbl","range":{"start":{"line":13,"character":11},"end":{"line":13,"character":20}}},"nodeType":"VARIABLE","children":[{"id":"n19","kind":"VariableDefinitionNameNode","name":"ACCT-FILE","locality":{"uri":"file:/FIXTURE/SAMPLE.cbl","range":{"start":{"line":13,"character":11},"end":{"line":13,"character":20}}},"nodeType":"VARIABLE_DEFINITION_NAME","children":[]},{"id":"n20","kind":"GroupItemNode","usageFormat":"UNDEFINED","external":false,"level":1,"specifiedGlobal":false,"redefines":false,"variableType":"GROUP_ITEM","name":"ACCT-REC","global":false,"synchronizedClause":false,"usages":[{"uri":"file:/FIXTURE/SAMPLE.cbl","range":{"start":{"line":71,"character":50},"end":{"line":71,"character":58}}},{"uri":"file:/FIXTURE/SAMPLE.cbl","range":{"start":{"line":74,"character":50},"end":{"line":74,"character":58}}}],"locality":{"uri":"file:/FIXTURE/SAMPLE.cbl","range":{"start":{"line":14,"character":7},"end":{"line":16,"character":45}}},"nodeType":"VARIABLE","children":[{"id":"n21","kind":"VariableDefinitionNameNode","name":"ACCT-REC","locality":{"uri":"file:/FIXTURE/SAMPLE.cbl","range":{"start":{"line":14,"character":11},"end":{"line":14,"character":19}}},"nodeType":"VARIABLE_DEFINITION_NAME","children":[]},{"id":"n22","kind":"ElementaryItemNode","value":"","isBlankWhenZeroPresent":false,"isSignClausePresent":false,"isDynamicLength":false,"isJustified":false,"isUnBounded":false,"effectiveDataType":"INTEGER","picClause":"9(11)","usageFormat":"UNDEFINED","level":5,"specifiedGlobal":false,"redefines":false,"variableType":"ELEMENTARY_ITEM","name":"ACCT-KEY","global":false,"synchronizedClause":false,"usages":[{"uri":"file:/FIXTURE/SAMPLE.cbl","range":{"start":{"line":8,"character":32},"end":{"line":8,"character":40}}},{"uri":"file:/FIXTURE/SAMPLE.cbl","range":{"start":{"line":72,"character":22},"end":{"line":72,"character":30}}}],"locality":{"uri":"file:/FIXTURE/SAMPLE.cbl","range":{"start":{"line":15,"character":11},"end":{"line":15,"character":44}}},"nodeType":"VARIABLE","children":[{"id":"n23","kind":"VariableDefinitionNameNode","name":"ACCT-KEY","locality":{"uri":"file:/FIXTURE/SAMPLE.cbl","range":{"start":{"line":15,"character":14},"end":{"line":15,"character":22}}},"nodeType":"VARIABLE_DEFINITION_NAME","children":[]}]},{"id":"n24","kind":"ElementaryItemNode","value":"","isBlankWhenZeroPresent":false,"isSignClausePresent":false,"isDynamicLength":false,"isJustified":false,"isUnBounded":false,"effectiveDataType":"STRING","picClause":"X(289)","usageFormat":"UNDEFINED","level":5,"specifiedGlobal":false,"redefines":false,"variableType":"ELEMENTARY_ITEM","name":"ACCT-DATA","global":false,"synchronizedClause":false,"usages":[{"uri":"file:/FIXTURE/SAMPLE.cbl","range":{"start":{"line":50,"character":20},"end":{"line":50,"character":29}}}],"locality":{"uri":"file:/FIXTURE/SAMPLE.cbl","range":{"start":{"line":16,"character":11},"end":{"line":16,"character":45}}},"nodeType":"VARIABLE","children":[{"id":"n25","kind":"VariableDefinitionNameNode","name":"ACCT-DATA","locality":{"uri":"file:/FIXTURE/SAMPLE.cbl","range":{"start":{"line":16,"character":14},"end":{"line":16,"character":23}}},"nodeType":"VARIABLE_DEFINITION_NAME","children":[]}]}]}]},{"id":"n26","kind":"FileDescriptionNode","isExternal":false,"fileDescriptorText":"FD  REPORT-FILE.","fileControlClause":"ASSIGN TO RPTDD","variableType":"FD","name":"REPORT-FILE","global":false,"synchronizedClause":false,"usages":[{"uri":"file:/FIXTURE/SAMPLE.cbl","range":{"start":{"line":10,"character":18},"end":{"line":10,"character":29}}},{"uri":"file:/FIXTURE/SAMPLE.cbl","range":{"start":{"line":47,"character":23},"end":{"line":47,"character":34}}},{"uri":"file:/FIXTURE/SAMPLE.cbl","range":{"start":{"line":53,"character":27},"end":{"line":53,"character":38}}}],"locality":{"uri":"file:/FIXTURE/SAMPLE.cbl","range":{"start":{"line":17,"character":11},"end":{"line":17,"character":22}}},"nodeType":"VARIABLE","children":[{"id":"n27","kind":"VariableDefinitionNameNode","name":"REPORT-FILE","locality":{"uri":"file:/FIXTURE/SAMPLE.cbl","range":{"start":{"line":17,"character":11},"end":{"line":17,"character":22}}},"nodeType":"VARIABLE_DEFINITION_NAME","children":[]},{"id":"n28","kind":"ElementaryItemNode","value":"","isBlankWhenZeroPresent":false,"isSignClausePresent":false,"isDynamicLength":false,"isJustified":false,"isUnBounded":false,"effectiveDataType":"STRING","picClause":"X(133)","usageFormat":"UNDEFINED","level":1,"s